<?xml version="1.0" encoding="UTF-8"?>
<!ELEMENT contacts (contact*)>
<!ELEMENT contact (name, phone*, website*, email+, knows)>
<!ATTLIST contact personID ID #REQUIRED gender (male | female) #REQUIRED>
<!ELEMENT name (first+, middle?, last)>
<!ELEMENT first (#PCDATA)>
<!ELEMENT middle (#PCDATA)>
<!ELEMENT last (#PCDATA)>
<!ELEMENT phone (#PCDATA)>
<!ATTLIST phone kind (Home | Work | Cell | Fax) "Home">
<!ELEMENT website (#PCDATA)>
<!ELEMENT email (#PCDATA)>
<!ELEMENT knows EMPTY>
<!ATTLIST knows contact IDREFS #IMPLIED>
