<?xml version="1.0" encoding="UTF-8"?>
<!DOCTYPE contacts SYSTEM "contacts.dtd">
<contacts>
    <contact personID="c1" gender="male">
        <name>
            <first>Ali</first>
            <middle>Bin</middle>
            <last>Abu</last>
        </name>
        <phone kind="Work">123-456-7890</phone>
        <website>http://ali.com</website>
        <email>Ali@email.com</email>
        <email>Abu@email.com</email>
        <knows contact="c2 c3"/>
    </contact>
    <contact personID="c2" gender="female">
        <name>
            <first>Ali</first>
            <last>Abu</last>
        </name>
        <phone kind="Home">234-567-8901</phone>
        <email>Abu@email.com</email>
        <knows contact="c1"/>
    </contact>
    <contact personID="c3" gender="male">
        <name>
            <first>Ah</first>
            <first>Beng</first>
            <middle>Bin</middle>
            <last>Abu</last>
        </name>
        <phone kind="Cell">345-678-9012</phone>
        <website>http://ali.com</website>
        <email>Abu@email.com</email>
        <knows contact="c1"/>
    </contact>
</contacts>
